id,created_utc,title,selftext,full_link
uehmag,1651222453,Inhalated Silo dust 6 weeks ago,"Hi all,\n\nI never had asthma. But 6 weeks ago I inhaled a lot of silo dust due to work accident.\n\nSince than I have trouble breathing, although my oxygen levels in my blood are good. Chest X ray and CT are all good and my lungtests are all fine too.\n\nBut still I wheeze when breathing in and out. Inhalers are not working and I really have trouble using my voice because of the ""obstructed"" airflow.\n\nAfter 6 weeks I still didn't make any improvements. Does someone in here have some advice?",https://www.reddit.com/r/Asthma/comments/uehmag/inhalated_silo_dust_6_weeks_ago/
uebtul,1651199697,Asthma and Animals,"So a good friend of mine has lots of animals, and anytime I go over there I end up having to but my inhaler way to many times before and after. After I leave I calm down in a couple of hours but definitely have to take extra hits on the Ventolin. With summer coming we’ll be able to hang outside more but I was wondering if there’s away to make it more tolerable when I’m in their house, as I really enjoy being there, my lungs just scream at me for it.",https://www.reddit.com/r/Asthma/comments/uebtul/asthma_and_animals/
ue9s1q,1651193360,How do I get (distilled) water out of nebulizer tubing? Is it still safe to use in an emergency?,"Okay okay, I KNOW the nebulizer tubing isn’t supposed to be washed or get wet. My partner tried to help me out by washing all the pieces to my PowerNeb Ultra and despite prior warnings, rinsed out the tubing as a “precautionary” measure without thinking the process through fully. \n\nMy allergies are killing me right now—as spring has sprung and the dogwood trees are on a mission to murder me. I am currently loaded up with Mucinex, Flonase, and Zyrtec but still feeling pretty wheezy (typical for this time of year). \n\nShould I just hit the ‘ol Ventolin with a spacer 8X (as I have heard that’s basically the same as a neb treatment), or is the dried tubing (ran the neb with tubing for 15min to flush it) okay until I can get to a medical supply store tomorrow? \n\nI know his heart was in the right place, but I explained how dangerous a single drop of water can be. Ugh.",https://www.reddit.com/r/Asthma/comments/ue9s1q/how_do_i_get_distilled_water_out_of_nebulizer/
ue8llq,1651189592,when do you use an inhaler??,"I am getting tested for exercise enduced asthma and they gave me an inhaler just in case. I always get a bit winded from basic activity, but not like, in pain, can't breath winded. Do I use it if I'm just really out of breath or just when it's really bad??",https://www.reddit.com/r/Asthma/comments/ue8llq/when_do_you_use_an_inhaler/
ue849f,1651188070,"[New] Acid triggered Asthma, first day with Albuterol (Need advice)",[removed],https://www.reddit.com/r/Asthma/comments/ue849f/new_acid_triggered_asthma_first_day_with/
ue6m6i,1651183679,Quick questions about effort induced asthma,"Hi, I was wondering how effort induced asthma is diagnosed. Can an doctor just listen to the lungs while the person is fully rested and make the diagnosis? Or is it a specific process? Since it is ""effort induced"" I am sort of expecting an effort to be part of the diagnostic... \n\nThank you for your time.",https://www.reddit.com/r/Asthma/comments/ue6m6i/quick_questions_about_effort_induced_asthma/
ue5noo,1651181016,Asthma comes and goes intermittently and doesn't respond much to inhalers,"I have moderate-to-severe asthma.\n\nSometimes I feel fine and can run 8 miles without problems.\n\nSometimes I have an attack sitting down doing literally nothing.\n\nI have tried Albuterol, Advair, right now I have Symbicort, all of these were the highest doses. Nothing seems to relieve my asthma.\n\nIt seems to come and go, sometimes I think, ""wow, it has been a long time since I had a proper asthma attack."" Then it comes back intense and lingers for a while and suddenly I am having attacks constantly.\n\nI have had my lung function tested, I actually have great lung capacity, paradoxically.\n\nI have had some allergy testing done, I don't have any symptoms of allergies, my sinuses are always clear, and I have never tested positive for an allergy.\n\nOddly enough, my asthma never bothers me at night, only during the daytime.",https://www.reddit.com/r/Asthma/comments/ue5noo/asthma_comes_and_goes_intermittently_and_doesnt/
ue44zw,1651176982,Organizing Asthma Supplies,"For those ith a small pharmacy worth of meds and nebs at home, how do you organize everything?",https://www.reddit.com/r/Asthma/comments/ue44zw/organizing_asthma_supplies/
ue3nn6,1651175700,Tips to get a 2 year old to take oral prednisolone?,My 2-y.o. son was officially diagnosed with asthma this week after battling colds every 2 - 3 weeks for the past 8 months. It's a relief to have an asthma action plan but since it's been less than a week we still have quite a bit of monitoring and figuring out what works/doesn't work for him. I spent this past Monday night in the ER with him and was sent home with a 4-day rx for oral prednisolone which seems to be getting him back towards normal breathing. Last night's dose was terrible... and took 3 attempts to get him the correct dosage as he kept spitting it out. \n\nDoes anybody have any tips on getting a toddler to take what I'm told is a terrible tasting oral medication such as prednisolone?,https://www.reddit.com/r/Asthma/comments/ue3nn6/tips_to_get_a_2_year_old_to_take_oral_prednisolone/
ue30qi,1651173993,Diagnosis?,"Which tests diagnose asthma? . Two great pulmonologists have different opinions. Diagnosed at the age of 30 (is it possible) ? X-ray , lung function, ekg , echo all clear still experience shortness of breath and chest heaviness especially while sleeping. \nDon’t know whom to trust ? Any advice will be appreciated. \nThanks pals.",https://www.reddit.com/r/Asthma/comments/ue30qi/diagnosis/
ue03sb,1651166202,Could this really be asthma?,"I have been suffering from chest tightness and breathlessness.\nI found it difficult to breathe into my chest, and instead I can only breath into my belly.\nNo wheezing or coughing.\nMy spirometry test was completely normal but the histamine challenge test was strong positive.\nI was coughing very violently during the test and wheezing. \nBased on this I was given the tentative diagnosis of asthma and prescribed a NEXThaler. \nI wonder if anyone has asthma with just breathlessness without wheezing and coughing?",https://www.reddit.com/r/Asthma/comments/ue03sb/could_this_really_be_asthma/
udxayh,1651158816,I have asthma,[deleted],https://www.reddit.com/r/Asthma/comments/udxayh/i_have_asthma/
udwa2q,1651156070,Advice?,[removed],https://www.reddit.com/r/Asthma/comments/udwa2q/advice/
udswcl,1651145637,My symbicort's meter looks like a speedometer,null,https://www.reddit.com/r/Asthma/comments/udswcl/my_symbicorts_meter_looks_like_a_speedometer/
udsjb8,1651144258,does your asthma severity change during certain months ?,"Just last year this has happened, spring i have mild-moderate depending on the day . sometimes i am okay experiencing minimal issues and others its like i have a cough as if i have a cold . summer is completely unpredictable, i usually have regular symptoms but experience flare ups to where a nebulizer would be needed and possibly oral steroids.  winter im okay i just need to avoid triggers and of corse the common cold / flu . anyone else experience this kind of thing ?",https://www.reddit.com/r/Asthma/comments/udsjb8/does_your_asthma_severity_change_during_certain/
udrhb6,1651139994,Quality of life: 24/7 clean oxygen mask,"since i was little i’ve always wanted to have a special mask or something that automatically provides me 24/7 clean air to breathe even when i’m in a heavily polluted area. \n\nNow thinking about it doesn’t sound like a bad idea. \n\nIt would be nice to not to get short of breath or have an attack when i come into contact with second hand smoke or chemicals, instead of pulling out my inhaler with my spacer evrytime. \n\nidk that’s just me i’m weird but i’m ok with that lol",https://www.reddit.com/r/Asthma/comments/udrhb6/quality_of_life_247_clean_oxygen_mask/
udndtx,1651122447,Struggling to get a preventative/daily inhaler instead of using my rescue almost daily,"I'm in a bit of a predicament here. I'm in my mid teens, and I've been diagnosed with cough variant asthma for twoish years. I was diagnosed after I had a strenuous battle with whooping cough and some of the blood tests revealed elevated markers for asthma. My parents and I never pursued any treatment because I didn't need it; as long as I didn't exercise and was cautious about not getting sick, I didn't experience many symptoms, at least, I thought I didn't.\n\nBut I've started realizing that my chest just always feels tight. It's not uncomfortable, but I just can't take a deep breath easily. When I inhale, it's like a slight resistance. I used to do my rescue inhaler, and that helped a ton, but then I realized it just.. never goes away unless I do the inhaler every 4-6 hours, which I don't think you're supposed to do with a rescue? If I am, then cool, but I still need something more manageable that doing an inhaler every 4-6 hours 24/7.\n\nI'm starting ROTC in the fall, and right now, without my inhaler, I can't run. It's not even a matter of stamina or endurance, it's literally like after 15 seconds of jogging, I'm wheezing and starting to get tingly in my fingers. My cap refill will be trash too. If I do my inhaler after that, it still takes a good hour or two until I'm back to normal ish. Now, if I do the inhaler fifteen minutes before working out, I'm better. Still takes me a long time to catch my breath, but as long as I do incremental runs, it's not too bad.\n\nBut with ROTC, I'll need to be running every day for long distances. I'm already planning on training over the summer, but I really need a preventative, daily inhaler so I don't keep needing to use my rescue. My brother took Pulmicort when he was younger, but his asthma was much more typical. I'm not necessarily looking for like, recommendations on treatments to try, but more just experiences maybe, or just support. I've wanted to be in the military since I was little, and if I can't manage my asthma reasonably there's no way I'll ever be able to join. I don't even really know all that triggers my asthma, apart from hot weather, exercise, dust/clay particles, and getting sick.",https://www.reddit.com/r/Asthma/comments/udndtx/struggling_to_get_a_preventativedaily_inhaler/
udl4pn,1651114837,Experiencing Dulera withdrawal (I think). By accident,[removed],https://www.reddit.com/r/Asthma/comments/udl4pn/experiencing_dulera_withdrawal_i_think_by_accident/
udk508,1651111812,Asthma Risk Increased in Children Conceived with Infertility Treatment | Clinical And Molecular Dx,null,https://www.reddit.com/r/Asthma/comments/udk508/asthma_risk_increased_in_children_conceived_with/
udeobz,1651095650,Accidentally swallowed Flovent,First time using my Flovent inhaler. I rinsed my mouth after but wasn’t in a place where I could spit out the water so I swallowed it. How bad is this?,https://www.reddit.com/r/Asthma/comments/udeobz/accidentally_swallowed_flovent/
udencn,1651095579,Got any other asthma pick up lines?,null,https://www.reddit.com/r/Asthma/comments/udencn/got_any_other_asthma_pick_up_lines/
udd0ym,1651091301,Delta 8/10 and Asthma,[removed],https://www.reddit.com/r/Asthma/comments/udd0ym/delta_810_and_asthma/
udc1ey,1651088714,Could I be having exercise induced asthma?,"I am 20 and never had shortness of breath before but after I started to run for 30 minutes 5 days a week, I started to notice a slight shortness of breath which was a bit unpleasant. Right after finishing exercising, I start to couch for a few seconds and after 2-3 hours after exercise the shortness of breath kicks in and usually lasts for 2 hours then it's gone. Sometimes it appears sometimes it doesn't. What could be? Should I go to the doctor? The others told me that my lungs are not fully prepared for running but I don't belive in that",https://www.reddit.com/r/Asthma/comments/udc1ey/could_i_be_having_exercise_induced_asthma/
udbfrn,1651087078,Advair vs Flovent: experiences?,"I was on 1 puff of Advair 100/50 a day and it controlled my asthma well. My doctor tried shifting me down to 2 puffs 2x a day of Flovent (which is 110mcg of the same steroid, fluticasone propionate). But it’s been a bit iffy with my asthma so for now I’m back on the Advair.\n\nI’m a bit surprised as the Flovent has 4x the steroid dose of the Advair I was one, so I’m curious to see what other peoples experiences have been when switching between the two? Does the long acting beta agonist make such a big difference?",https://www.reddit.com/r/Asthma/comments/udbfrn/advair_vs_flovent_experiences/
ud6n9e,1651074425,Oxygen saturation under 95%,"I just had bronchitis and still have some productive cough (not intense anymore). Today I started feeling dizzy (without SOB), so I measured my oxygen saturation. It varied between 93 and 97, but mostly stays at 94%. My only symptom is dizziness. Does anyone else know this? Should I go to the doctor?",https://www.reddit.com/r/Asthma/comments/ud6n9e/oxygen_saturation_under_95/
ud3qyp,1651066563,How do deal with bad asthma days,[removed],https://www.reddit.com/r/Asthma/comments/ud3qyp/how_do_deal_with_bad_asthma_days/
ud2oyu,1651063439,tips to cope with bad asthma days,[removed],https://www.reddit.com/r/Asthma/comments/ud2oyu/tips_to_cope_with_bad_asthma_days/
ud0caz,1651055101,What seems to be going on ?,"Over the winter i have noticed my asthma flares up when i drink something really cold . i get this coughing attacks and\nI cant catch my breath and i need to sit down and im literally gasping for air . once i use my rescue inhaler im okay , usually days later sometimes im left with symptoms , i know its spring now and i am also experiencing allergy symptoms , but im not sure if this is related but yesterday i felt a coughing fit coming on and then i felt i was breathing all fast i was coughing and i used my rescue inhaler and i was okay after . does this kinda thing happen to anyone else ? and im wondering if its allergy related or cause of the lingering symptoms from the cold drink",https://www.reddit.com/r/Asthma/comments/ud0caz/what_seems_to_be_going_on/
ucxyzs,1651044540,Neb does not help!,[removed],https://www.reddit.com/r/Asthma/comments/ucxyzs/neb_does_not_help/
ucwj5t,1651038717,I can’t tell if my asthma has gotten worse because of weed or covid,[removed],https://www.reddit.com/r/Asthma/comments/ucwj5t/i_cant_tell_if_my_asthma_has_gotten_worse_because/
ucwa6u,1651037748,"Kinda concerned about covid, people who've had it, please share your stories?",Im most concerned about the lung damage that can occur.,https://www.reddit.com/r/Asthma/comments/ucwa6u/kinda_concerned_about_covid_people_whove_had_it/
ucvdhf,1651034208,"Don't have health insurance to check, is this Asthma?","As the title says, I don't have the insurance to go to a doctor for tests. I'm 17, I'm not athletic, but I'm in shape. Last time I remember being able to run was when I was like 6. Since then I've always had problems running. Lately I've been practicing for boot camp, but when I run, less than one minute into my run, my throat starts to close up, and I have trouble breathing. Does that sound like Asthma?",https://www.reddit.com/r/Asthma/comments/ucvdhf/dont_have_health_insurance_to_check_is_this_asthma/
ucuv38,1651032300,"My mom thinks I have asthma, but won’t get me diagnosed?",[removed],https://www.reddit.com/r/Asthma/comments/ucuv38/my_mom_thinks_i_have_asthma_but_wont_get_me/
uctepi,1651027357,Need advice from the asthma experts! (New-ish asthma mom),"My four year old was “diagnosed” with asthma about a year and a half ago now. I know that they can’t officially be diagnosed that young but we had seen two different pulmonologists that both stated this to be their belief and who built treatment plans off it. We first got referred because of these weird recurrent “croup like” episodes that would land us in the urgent care or ER nonstop. She’s had chest X-rays, blood allergy testing, etc that all came back normal and the pulmonologists seem to think this is just run of the mill asthma. My question is… do any of you/your children/etc have this weird presentation as well? I guess in my head asthma seemed like the typical wheezing issues or kids who needed a rescue inhaler at soccer and so forth. We’ve tried oral steroids, albuterol, budesomide (sp?), and Flovent to no avail… This week we start Advair. Despite both pulmonologists agreeing this seems like asthma I just still struggle with feeling unconvinced… probably also due to the fact that we haven’t seemed to be able to dial in a solid treatment yet. I’m so frustrated that we’ve not been able to slow down or stop these episodes for her. There’s nothing worse (personally) than her being miserable and me not knowing how to help/not knowing if what we’re doing is actually helpful. We’re in the middle of another episode and I’m just laying here next to her while she sleeps… any advice, encouragement, whatever would be so appreciated. Thanks for making it this far lol.",https://www.reddit.com/r/Asthma/comments/uctepi/need_advice_from_the_asthma_experts_newish_asthma/
uct9tz,1651026893,honestly me tonight. phew 😅,null,https://www.reddit.com/r/Asthma/comments/uct9tz/honestly_me_tonight_phew/
ucpouc,1651015511,i need help idk if these are regular symptoms of asthma after i use my inhaler i still have lingering tightness,null,https://www.reddit.com/r/Asthma/comments/ucpouc/i_need_help_idk_if_these_are_regular_symptoms_of/
ucpfbu,1651014715,What should i do,"So i put up a post a few weeks ago asking if i had asthma,i went to a pulmonologist and only did 1 spirometry and it came back ok,she said it was allergies and gave me a cough syroup and allergy pills,i finished all the medicine but it honestly seems like my cough is getting worse,i wheeze and i have shortness of breath.Should i go back and get some more tests like the methacholine challange or PFT?",https://www.reddit.com/r/Asthma/comments/ucpfbu/what_should_i_do/
ucp4ro,1651013863,Asthma,[removed],https://www.reddit.com/r/Asthma/comments/ucp4ro/asthma/
ucniyq,1651009319,Feel terrible after using my inhaler and drink pre work out,[removed],https://www.reddit.com/r/Asthma/comments/ucniyq/feel_terrible_after_using_my_inhaler_and_drink/
uchkhm,1650993258,Flovent / Arnuity,[removed],https://www.reddit.com/r/Asthma/comments/uchkhm/flovent_arnuity/
ucgz3e,1650991657,Flovent / Arnuity,[removed],https://www.reddit.com/r/Asthma/comments/ucgz3e/flovent_arnuity/
ucfa75,1650987181,Albuterol helped 2 year old. Does this mean she has asthma ?,"Daughter had persistent cough. Had to undergo bronchoscopy cause doctor suspected something stuck . Was on steroids for 3 days. Didn’t have cough for the next month approx. We visited a tropical destination at that time ( live in Pacific NW) . We came back , all of us had Covid , and her cough started a week after and has not stopped. Yesterday we gave her albuterol and the cough stopped magically in 2 minutes. \nWhat does this mean ? She also has eczema but no other wheezing symptoms . Cough doesn’t happen always .",https://www.reddit.com/r/Asthma/comments/ucfa75/albuterol_helped_2_year_old_does_this_mean_she/
uccgd9,1650979304,Exercise with a cold… good or bad idea?,"I’ve read mixed reviews and I want to know your experience. I’ve been battling a cold for two weeks and am pregnant. I’ve been trying to move my body most days in hopes of sweating it out and breaking up the chest congestion. Somehow, I can exercise pretty well, I just can’t talk much without coughing. But now I’m reading that while exercise helps colds in some, in asthmatics it can create more lung mucus. \n\nHave you found one or the other to be true?",https://www.reddit.com/r/Asthma/comments/uccgd9/exercise_with_a_cold_good_or_bad_idea/
uc8t8z,1650966431,Prednisolone after covid?,"Hi, \n\nI had covid around April 9 tested positive, had to take antibiotics for a chest infection that’s screwed my stomach up with nausea. Finished those today but my asthma is flaring thanks to covid and I have a bit of a wheeze. \n\nI already take a puffer that’s combined steroidal preventer morning and night. Obviously since covid I’ve had to take my blue puffer now Atleast once a day because thinks aren’t controlled well. \n\nIve never had to take Prednisolone and I’m concerned about side effects. Because I have to start tomorrow to have a morning and afternoon dose, I’m a bit nervous. \n\nHas anyone been on this before to negate asthma flare? \n\nI also take another anti inflammatory as I developed pericarditis a few months back from vaccine but the pharmacist said it’s fine as not contradicted. \n\nWill it help break up phlegm and therefor I’ll be able to breath better? \n\nLet me know what your experiences were - positives ones would be great.",https://www.reddit.com/r/Asthma/comments/uc8t8z/prednisolone_after_covid/
uc7evn,1650960046,Anyone have any luck with herbs or natural resources to help strengthen your lungs?!,I quit smoking and the asmtha and cough has gotta so bad. Urg. Just wanna feel better,https://www.reddit.com/r/Asthma/comments/uc7evn/anyone_have_any_luck_with_herbs_or_natural/
uc3cta,1650943917,I have asthma and MCS so bad I'm scared to do anything anymore.,"My asthma and chemical sensitivity is so bad I am scared to do anything anymore.\n\nI have very bad reactions to various chemicals in the air in particular E-Cig aerosols seem to really trigger me. I think I have Chemical Sensitivity.\n\nMy main issue is I travel a lot and I will be in a hotel. So I go out to eat or work or whatever. Somewhere along the way on that particular day I encounter something bad in the air, some lingering chemical. I start to get terrible asthma and even after I am long gone it is on my clothes triggering my asthma so now I am in my room and I can't sleep. My clothes are there with me I can't walk around naked. So my clothes picked up chemicals and asthma triggers that literally suffocate me in my room. I now can't sleep.\n\nSo my attempts to wash my clothes are unsuccessful. I'll go to a laundromat wash them come back and the clothes are giving me asthma still and sometimes worse in my room. \n\nThis past week I washed my clothes 3 times at local laundromats here in a new town I'm staying. The first time I got real sick from the first laundromat. So I went to a second laundromat used some vinegar in the water. Still no difference clothes make me sick, can't breath. Third laundromat, didn't make a difference.\n\n I can't keep them in my hotel room because I can't breath they suffocate me in the room. I put them in my car and they make it so I can't breath in my car. Should I just throw away my clothes at this point? They are making my car so bad I can't breath.\n\nI don't have the money to rent air bnb cabins or guesthouses where I could set the clothes outside so i can sleep. In the past that had worked, just setting them outside and removing the asthma trigger. Can't afford, not enough money.\n\nI am severely depressed and feel hopeless at this point. I have thrown away so many clothes because I can never get them to where they aren't triggering my damn asthma! I literally have to buy new clothes all the time and i can't really afford to keep doing this. This only started happening to me in the past 5 years.",https://www.reddit.com/r/Asthma/comments/uc3cta/i_have_asthma_and_mcs_so_bad_im_scared_to_do/
uc37nn,1650943446,Montelukast: Anyone have side effects?,"Hi fellow asthmatics! I don't know how many of you guys are currently taking Montelukast (a.k.a Singulair), but I got a question for the ones who do. I have been taking Montelukast for about 2 weeks now. Ever since I started taking the medicine, my breathing has been so much better. But I think there are some side effects to it also. I have experienced nightmares almost every other night, on the dot 3 hours after I've fallen asleep. And these nightmares are always similar. Very abrupt. And when I wake up from these nightmares, I would have sleep paralysis. Also, some really bad anxiety at night. I would have not hallucinations per say, but I start to think and convince myself that there is something either in the room with me, or at the window, or something trying to get me. These are the only symptoms I think I have, nothing else physical or anything like that.\n\nI've never experienced this before taking Montelukast. It's gotten so bad to the point where I can't sleep without a light on. I might just be crazy and none of this is related, but I've read online that there are psychological side effects. My mom thinks that its unrelated. Has anyone experienced anything similar? If so, is there anything I can do to stop the side effects? Because I really want to keep taking the medicine, but I don't want to sacrifice my sleep to it either :/\n\n&amp;#x200B;\n\n(also sorry for all of the reading)",https://www.reddit.com/r/Asthma/comments/uc37nn/montelukast_anyone_have_side_effects/
