id,created_utc,title,selftext,full_link
u75hee,1650375791,Severe asthma that cannot be controlled by regular treatment. Has anyone experienced this.,"Hi friends. I’ll try to keep it short. I’ve been a mild asthmatic for much of my life but in the past 5 years it’s become severe and uncontrollable. I’ve tried many different medications but as time goes by, they become less and less effective.\n\nCurrently I’m on Breo Elliptor and Incruse Elliptor once a day but I have had 2 exacerbations in 3 weeks whereby I am needing my reliever every hour. I’ve had 2 courses of oral steroids in that time which hasn’t made a great deal of difference and then an additional steroid puffer. I felt amazing for a few days on the new steroid puffer but as soon as I reduced it as instructed by my GP, I feel awful again.\n\nAny advice, ideas or sharing of your own experience/treatment is very much appreciated.",https://www.reddit.com/r/Asthma/comments/u75hee/severe_asthma_that_cannot_be_controlled_by/
u72whe,1650367701,My lungs feel like sandpaper!,"I don't understand why my lungs are sooooo incredibly dry and sensitive ,its like even the slightest dryness or air pollution instantly make my lung tubes to dry up and constrict ,and asthma inhalers help minimally😞😤",https://www.reddit.com/r/Asthma/comments/u72whe/my_lungs_feel_like_sandpaper/
u7175e,1650361157,Fuzzy feeling in head after lowering preventer inhaler dosage,"In the UK we have a blue and brown inhaler, blue being the reliever (Salbutamol) and brown being the preventer (Belcometasone dipropionate) \n\nI’ve been told to have minimum 2 puffs morning and night and if you feel as if you need to then have 4 morning and night. For roughly 2 months or so I’ve been doing 4 puffs morning and night due to the doctor actually recommending 4 (I’d been off the preventer for a while when i got them a few months ago and i was getting chest pains and other symptoms which prompted me going back on it) and I also have long covid so they recommended not to take any chances with that.\n\nIt may be too soon to say but i’ve gone back to 2 puffs now for only 2 days and now my mornings feel like a blur and can’t focus on anything, brain fog to the max effectively. I’m aware it’s a steroid so could it be the inhaler causing this? I feel as though there’s a direct correlation but I could be completely wrong. I’m due to see the doctor at the end of the week so I will clear this up but I want to see everyone’s opinion.\n\nAny advice is appreciated.\n\n(And also should I just go back to 4 then?)",https://www.reddit.com/r/Asthma/comments/u7175e/fuzzy_feeling_in_head_after_lowering_preventer/
u70xib,1650360004,Do crying and asthma flare ups go hand in hand?,"Question, I’m wondering is it reasonable to assume that because I’ve been crying a lot lately (yay mental illness) I’ve been triggering my asthma more frequently? Does crying trigger you guys’ asthma too? Not sure if I’m missing some other trigger and all I can think is the crying. \n\nMay you breathe easy, and thanks.",https://www.reddit.com/r/Asthma/comments/u70xib/do_crying_and_asthma_flare_ups_go_hand_in_hand/
u6zf4q,1650353484,Just diagnosed with allergy induced asthma,"Hi all. Last Tuesday I started to have trouble breathing. Chest pain, felt like my throat was closing up, cough but not? Got diagnosed the next day. Also did allergy testing, worst thing for me is Timothy grass. I’ve had spring allergies since I was a kid but never asthma. \n\nI was wondering if anyone had any natural remedies that help them? Unfortunately, the inhaler doesn’t seem to do anything. I can breathe again but I’ve felt sick for days. Is that normal? Like I have a cold but not? \n\nThanks",https://www.reddit.com/r/Asthma/comments/u6zf4q/just_diagnosed_with_allergy_induced_asthma/
u6u6o4,1650334833,omg perfect timing 😭,null,https://www.reddit.com/r/Asthma/comments/u6u6o4/omg_perfect_timing/
u6t3um,1650331583,Asthma vs gerd,"Hi guys, was wondering how you tell if your symptoms are more indicative of gerd or asthma when the symptoms of each tend to overlap so much. Gonna ask my pcp but was just wondering if there’s something that makes it more likely to be one or the other",https://www.reddit.com/r/Asthma/comments/u6t3um/asthma_vs_gerd/
u6t08p,1650331277,Asthma or anxiety?,"Hey everyone, 24F here. Had asthma as a child and into my teen years. Noticed that it didn't bother me as much as I got into my 20s. Regular (everyday) cannabis smoker as well for about 3 years. Started to wheeze one day pretty bad and the doc put me on 1 month of flovent and salbutamol as needed. Meanwhile, I stopped smoking and haven't smoked since. While on the flovent, I only used the salbutamol for the first couple days then didn't need it. Once my flovent treatment had completed, I started to feel a sharp pain in my tonsils and dry mouth after about a week. I couldn't sleep for about a week because of the sharp pain and dry mouth. I was constantly gagging and coughing. Then started to feel short of breath again but without wheezing. Went to the ER to get checked out, was told my dry mouth was due to asthma and was put on 5 days of prednisone (50mg/day) + another flovent inhaler + salbutamol as needed. Dry mouth/tonsil pain went away. I finished my 5 days of prednisone and am still doing the flovent inhaler everyday. I'm supposed to use it 2x/day, 2 inhales for 2 weeks then as needed. It's been a week and my shortness of breath hasn't gone away. Went to the ER again and everything seems normal. They did an x-ray and listened to my breathing and nothing. I also went to the doctor and they prescribed me some anti-depressants which I am hesitant on taking. I really don't want to be reliable on any medication that I don't need to and have decided to take up counselling to manage my anxiety. I'm worried that the dry mouth and tonsil pain will come back as I wean off of my flovent inhaler. As well, I'm just worried that I'll have to be on inhalers long-term and I really don't want to have that burden. I'd be happy to hear your thoughts or your experiences with asthma, anxiety, dry mouth, and shortness of breath. I constantly feel like my chest is tight and it's tiring. Thanks everybody.",https://www.reddit.com/r/Asthma/comments/u6t08p/asthma_or_anxiety/
u6rssz,1650327698,Asthma symptoms seem to come back near the end of the two weeks after taking Xolair injections…,"Has anyone else experienced this? I’m on xolair for about 4 months now, recently I noticed that my shortness of Breath seems to come back around day 11/12 after taking the biweekly xolair…",https://www.reddit.com/r/Asthma/comments/u6rssz/asthma_symptoms_seem_to_come_back_near_the_end_of/
u6pr6a,1650321962,Chest becomes tight everytime I open up my book,"I was diagnosed with asthma 2 weeks ago and was given albuterol and Flovent. The Flovent and albuterol got rid of my chest tightness and cough symptoms that I’ve had for the past 2 years (thank god). My only problem now is that everytime I sit down to read a book, my chest becomes tight and I begin to cough. I don’t know if this is due to the smell of the book or if I’m allergic to new books now.",https://www.reddit.com/r/Asthma/comments/u6pr6a/chest_becomes_tight_everytime_i_open_up_my_book/
u6plb3,1650321496,Trelegy,"Have been taking Breo for about a month now with hardly any noticeable difference in breathing issues. Still have phlegm and burning chest. It doesn’t feel like heartburn, since I’ve had that before, and had a much different sensation. The doctor recommended Trelegy. Wondering if this will even help with my issues, since it has the same steroid and laba as Breo. I didn’t want to question her, since she’s the doctor.",https://www.reddit.com/r/Asthma/comments/u6plb3/trelegy/
u6p5v1,1650320332,Survey about outdoor air quality,"Hi r/asthma,\n\nI'm a software developer and recently quit my job to try and do something about improving outdoor air quality. I would really appreciate it if folks could spend a few minutes filling out this short survey:\n\n[https://forms.gle/uFMd17aZ7wPa82Ud7](https://forms.gle/uFMd17aZ7wPa82Ud7)\n\nBesides the survey itself, I'd love to hear in the comments any thoughts you have to share about air quality in general.\n\nThank you!",https://www.reddit.com/r/Asthma/comments/u6p5v1/survey_about_outdoor_air_quality/
u6nxze,1650317042,Any drug interaction between Formoterol and budesonide 200 inhaler and sertraline + alprazolam?,I just got prescribed sertraline and alprazolam for my anxiety and was wondering if it has any interactions with my asthma medication? I’m really anxious about things like this so any help would be appreciated. I’ll have to wait another week to ask my doctor since I can’t get an appointment any time soon. But I also don’t want to stop taking the inhaler cold turkey.,https://www.reddit.com/r/Asthma/comments/u6nxze/any_drug_interaction_between_formoterol_and/
u6kt9w,1650308773,"Dr. Andrew Halayko, PhD, FCAHS, ATSF will be doing an AMA latest asthma research on April 20 at noon ET/9am PT.","The AMA should be at /r/AMA, so I am locking this thread so people don't post questions here expecting answers. \n\n**PLEASE NOTE HE CANNOT ANSWER PERSONAL HEALTH OR INSURANCE QUESTIONS.**",https://www.reddit.com/r/Asthma/comments/u6kt9w/dr_andrew_halayko_phd_fcahs_atsf_will_be_doing_an/
u6km46,1650308277,Do exercise when having asthma symtpons?,"I have being a week feeling small asthma symptoms. I can live well, and overall I tend to control it. But I  try to avoid exercise or things that triggers my asthma until I feel recovered.\n\nThe thing is , I am not sure if I am doing right. I want to get fit, one of the reasons to reduced my  asthma symptoms. So I ask myself, should I exercise while having asthma symptoms(low)? Does it have good/bad or none effect?",https://www.reddit.com/r/Asthma/comments/u6km46/do_exercise_when_having_asthma_symtpons/
u6htem,1650300930,Article on asthma triggered by bacteria,Interesting article on some discoveries about a severe form of asthma caused by bacteria.  \n\n[https://medicalxpress.com/news/2022-04-scientists-link-severe-asthma-paving.html?utm\_source=join1440&amp;utm\_medium=email](https://medicalxpress.com/news/2022-04-scientists-link-severe-asthma-paving.html?utm_source=join1440&amp;utm_medium=email),https://www.reddit.com/r/Asthma/comments/u6htem/article_on_asthma_triggered_by_bacteria/
u6gb32,1650296962,Best clinic for asthma in London,"Hi,\n\nWhich clinic do you recommend for a person with asthma in London?\n\nThanks",https://www.reddit.com/r/Asthma/comments/u6gb32/best_clinic_for_asthma_in_london/
u6f7jd,1650294088,best humidifier air purifier,null,https://www.reddit.com/r/Asthma/comments/u6f7jd/best_humidifier_air_purifier/
u6e5g3,1650291233,Ways to improve?,"So this morning when taking out the dorm trash it was raining so I ran out to the dumpster to throw the trash out but once I got back to me room I started having an asthma attack, I only ran for about 15 seconds too.\nIt was hard to breathe, was breaking into a sweat and I was doing my best to regulate my breathing, almost felt like throwing up as well.\n\nI have exercise induced asthma how do I improve without agitating it too much, I used to play football, baseball and basketball in school years back but now if I even run for a few seconds I have an asthma attack.",https://www.reddit.com/r/Asthma/comments/u6e5g3/ways_to_improve/
u6c3dr,1650285273,Is this asthma or something else?,"I am currently seeing a doctor about my breathing issues and have been trying a few different treatments. I was told to use my blue inhaler (ventolin) whenever I needed it. I was using it over 3 times a week, every week. My doctor then gave me a brown inhaler (steroidal) and told me to take it twice in the morning and then twice in the evening. I found that immediately after use I felt quite tight in the top of my chest. After 2 days I told told doctor and he prescribed a turbohaler which is kinda like a salt shaker. So far that's been alright but because I'm on holiday I haven't been able to compare this to my usual routines. Today tho I had a weird moment where I randomly felt breathless despite sitting down. I had to take 2 puffs of my blue inhaler where I only usually take 1 if I'm breathless before. Unless more of these episodes happen I'll be taking the turbohaler for at least until the end of summer\n\n\nI should mention that over the past few years my breathing capacity has gone downhill. Despite an increase in excersise I kept getting out of breath easier and easier over the years and in the first lockdown it went down significantly faster and then kinda....stopped... like it hit a barrier. \n\n\nI don't have episodes where suddenly I'm out of breath, at least never in the past. As soon as I wake up it's there, never really goes up or down in the day. I feel like stress is a big factor but I'm not sure. I might get put through stress testing for another issue at some point in the coming months but I'm not sure yet",https://www.reddit.com/r/Asthma/comments/u6c3dr/is_this_asthma_or_something_else/
u6b0wb,1650281782,(Full Audiobook) Coping With Asthma,null,https://www.reddit.com/r/Asthma/comments/u6b0wb/full_audiobook_coping_with_asthma/
u6ari3,1650280811,Common Triggers of Asthma,null,https://www.reddit.com/r/Asthma/comments/u6ari3/common_triggers_of_asthma/
u67zyn,1650269662,inhaled gravel dirt at a house concert,I just started to heal from long covid breathing problems ontop of having reactive asthma already. Jumped into the pit at a house show little did i know i was inhaling clouds of dirt flying in the air from everyone dancing. I instantly was coughing up phlegm and had to borrow a friends inhaler. Today my lungs have just been stinging me really bad:( do i need to get prednisone again. What can help with the chest stinging.,https://www.reddit.com/r/Asthma/comments/u67zyn/inhaled_gravel_dirt_at_a_house_concert/
u63as6,1650251366,Asthma and Post-Nasal Drip Symptoms For A While,"Hello, I am quite new to this sub and any sort of answers would be appreciated very much. This is a sort of a copy-past post I made on the askdocs sub but never seemed to get an answer at all so I might try my shot here. \n\n As the title says, I have been having this issue for quite some time now since April of 2020 precisely. I wanted to make this post to possibly get some insights about this issue I have been dealing with and some help from the doctors would truly help.\n\nAt this point, we were still in a lockdown I believe, and I had no reason to step out much really, and during this time I would Vape a lot constantly during the lockdown period. I continue this chain-smoking almost every day and hold in the smoke for 5-10 seconds. One day, I continued the same way of smoking, and immediately felt short of breath and then immediately stopped for about 1-2 weeks. During this time, I felt some back pain while I took the break and it was aching a lot like I had sprained it somehow but it eventually went away after that break. I then decide maybe I am good to smoke again, and then while inhaling it, the smoke kinda hurt my lungs when taking it in and there were days I would just smoke through it but not too much.\n\nThis eventually leads to suddenly me spitting out blood (without any cough). I could not tell where it was coming from whether it was from my lungs or my braces because, at the time, I did have braces on. I am panicking at this point, so I stop and decide to take another break should resolve the issue. I get back to smoking again, my lungs hurt, I still go through with it sometimes, then stop. The blood issue only seemed to get worse because there were days when I spat out a lot and I could not tell where it was coming from. I soon develop a cough that would go on for months.\n\nI finally decided to go to a doctor and this led to many tests like blood tests, chest X-rays, pulmonary function tests, covid tests, etc. My tests came out normal and I was given a steroid and albuterol inhaler. This helped my cough to be in control but it would come back again after a couple of days when I was done with the dosage (I used it every day). Now, this did help the cough to be in control but it also did not really resolve my shortness of breath issues and the pain in the lungs I would have at times. I was given the same medication again and the same thing would repeat again. I went again to my doctor for a physical and he did mention my cough could be due to a post-nasal drip but I did not really believe him until now.\n\nNow a couple of months ago, I start to realize where the bloody phlegm is starting to come from which is the back of my nose. This happens especially during the shower when there is hot vapor around and for that, I have started taking a steroid nasal spray and I think it's working. My cough has been gone for quite some time now on its own without any medication.\n\nToday, I am still suffering from most of these issues, and I am really frustrated and will be going to the doctor again soon. There are times when I feel like my lungs are wheezing, but there is no phlegm, sometimes when I laugh too I can hear and feel the vibration. When I run, my lungs hurt when I breathe in, and brings back the wheezing sounds when I exhale out through my mouth (this never happened before just for reference). The bloody phlegm happens at times but only in certain environments that come from the back of my nose.\n\nI apologize for this long and possibly confusing post, but I would like to hear what kinds of treatments I will be looking at to control these issues? Stronger steroid inhalers to control my lung issues? Is the steroid nasal spray good enough to treat with Post-Nasal Drip? I would like to hear from you. Thanks in advance!",https://www.reddit.com/r/Asthma/comments/u63as6/asthma_and_postnasal_drip_symptoms_for_a_while/
u60b5s,1650241863,"I'm an avid runner, marathon runner, and ultra runner. this January I started coughing, sometimes dry sometimes mucus. I've taken multiple antibiotics over the last few months. taking an inhaler and singulare again and I still keep coughing I can't even run a mile I'm desperate to feel better",[removed],https://www.reddit.com/r/Asthma/comments/u60b5s/im_an_avid_runner_marathon_runner_and_ultra/
u5z5wj,1650238258,Any remedies that work? I have ran out of my inhaler and can’t get a new one since it is Saturday.,null,https://www.reddit.com/r/Asthma/comments/u5z5wj/any_remedies_that_work_i_have_ran_out_of_my/
u5xdf0,1650232918,Do your pulse ox levels stay fairly consistent when your asthma is generally under control?,null,https://www.reddit.com/r/Asthma/comments/u5xdf0/do_your_pulse_ox_levels_stay_fairly_consistent/
u5s7w0,1650217692,"Powdery, chemical taste in mouth. Constantly.","I would've thought this would be a common subject, but I haven't had much joy in finding something relating to my issue.\n\nI'm from England, just to give an idea of medication if it varies.\nI was diagnosed with eosinophilic asthma last year when I was 30. No prior issues or family history. Fun times. I've been using the pink Fostair 100/6 pump, with an AeroChamber spacer. For the past five months or so, I have such a strong taste of chemical powder in mouth pretty much throughout every day. So many meals and drinks just don't taste the same anymore.\n\nNo drinks or food can overpower it. Brushing my teeth doesn't resolve it. It's just become a very unpleasant part of my life now. I have to believe this isn't something I'm supposed to just accept, and that there is a resolution. \n\nNaturally I'll discuss this with my GP, but I wanted to reach out to people for some help and advice initially.\n\nAnyone else been through the same and have a solution?",https://www.reddit.com/r/Asthma/comments/u5s7w0/powdery_chemical_taste_in_mouth_constantly/
u5s2de,1650217235,the best air purifier for home,null,https://www.reddit.com/r/Asthma/comments/u5s2de/the_best_air_purifier_for_home/
u5mt41,1650201226,Possible GERD?,"Hello friends! I’ve been dealing with asthma issues with my breathing and chest tightness, went into a flare last month with the spring weather. Did a round of steroids which helped and dr prescribed advair but it’s not doing much. I got a chest X-ray done and everything is clear. I think what I’m experiencing is acid reflux for the past few weeks, I don’t think it’s my asthma. Weird shooting pains in chest, usually on the left side, chest feels sore and tight especially in the middle, sometimes I do have acid come up my throat. Burning chest feeling sometimes. I want to try a OTC heartburn med to see if it will help.  (i should also add I have anxiety which doesn’t help), can anyone recommend anything to try? I have TUMS but that doesn’t do much.  \nTIA :)",https://www.reddit.com/r/Asthma/comments/u5mt41/possible_gerd/
u5lufh,1650197707,Have you ever had an experience when you thought your asthma was “ gone “ but it wasnt ?,"in 2013 i had changed my diet , slowly began to exercise. back then my asthma always acted up when i ran or did any crazy physical activity . about a year later i noticed i wasnt experiencing any asthma symptoms . one night i was partying , had the worst attack in my entire life . since then my asthma has “ come back “",https://www.reddit.com/r/Asthma/comments/u5lufh/have_you_ever_had_an_experience_when_you_thought/
u5hb94,1650177811,mental strain,"U ever compare your symptoms and/or experiences to other people's and think that u have it easy and have no reason to complain even though its a chronic illness theres basically no way u can have it easy? This shit fucks with me so much mentally omg. Its frustrating and im constantly reminded every single day that my lungs are fucked and i know they are but then i see posts from other people and immediately put myself down bc my asthma may not be as sever as theirs is. And its great when i see others post their experiences (the experiences themselves aren't great but ya know talking ab them is, trusting people and what not). My asthma was very sever when i was younger to the point where my parents would take turns watching me sleep as a baby bc i would just stop breathing and my face was apparently almost always blue. I missed so much school the first couple years. It faded a bit, still there but more mild and then everything came crashing down in 2019 when i had an attack at volleyball practice so bad i turned blue and almost passed out. I didn't have any inhalers at the time bc my asthma was more mild so we all thought i finally outgrew it and got rid of everything pertaining to my asthma. Ig since it ""came back"" (basically just got *really* severe again) i haven't been 100% mentally. Maybe the stress of 2019 being the same year covid started and both of my grandparents on my dads side of the family died added up and the stress made my asthma worse. Since then it has gotten better though and even if that sounds like a lot it will never be enough for me. I will never stop thinking others have it worse and i will never admit to myself that i need help from anyone bc i have to much pride in myself and i *hate* that so much. I will never stopped being ashamed of a disease i didn't even choose to have. \nSorry i needed to rant this probably doesn't even make sense",https://www.reddit.com/r/Asthma/comments/u5hb94/mental_strain/
u5ezz0,1650168457,Went hiking today and like a dumb—- I forgot my inhaler,"I’m not looking for sympathy. I wanted to share. \n\nI was on an incline and you know that heart racing trying to catch your breath moments that can happen, yeah I was there. Our elevation gain was from sea level to the top of a few hills, roughly 500 feet to 1000 feet. \n\nSo I had to stop at the top of each hill, put my arms above my head and force myself to breathe through my nose for the count of 8 hold and let out hold and breathe in. The first few times I couldn’t get past the count of 3, then I made it to 5 and then eventually 8. \n\nThis breathing technique has saved me more times then I can remember. It slows down my panic and let’s me focus. When I put my arms above my head like that it opens my airways more. \n\nI won’t forget my rescue inhaler again that’s for sure.",https://www.reddit.com/r/Asthma/comments/u5ezz0/went_hiking_today_and_like_a_dumb_i_forgot_my/
u53zmn,1650133780,Which medicine,It seems adderall growing as a child really helped my breathing. \n\nIt seems hot to cold but especially hot air and humidity trigger shortness of breath. \nI never wheeze but I feel like I can’t breath and if I lay on my stomach it gets better. I have stomach bloating and food allergies however I’m on. A restricted diet. \nSeems stress is a trigger and inhaler pollen. \n\nAgain I never wheeze just gets tight like I’m breathing into a sponge. \n\nIs this asthma and if so what medication is best. I trie spiriva and advair for over a week and I’m not sure they made a difference. \n\nThanks!,https://www.reddit.com/r/Asthma/comments/u53zmn/which_medicine/
