id,created_utc,title,selftext,full_link
uagczy,1650752613,Hoarseness and gunky throat? DAE?,I ain’t sick that I’m aware of but gosh I’m hacking out so much crap from my throat and I was barely able to speak. Vocal cord dysfunction? Asthma? Wtf? This has occurred multiple times.,https://www.reddit.com/r/Asthma/comments/uagczy/hoarseness_and_gunky_throat_dae/
uafzde,1650751431,I'm a little confused,"Hey everyone this is my first time posting here sorry if anythings confusing 😅\nI've been confused recently as I (M19) have had asthma my whole life aswell as my father and sister (my mother doesn't have it) I've recently somehow only noticed that in my whole life of having asthma I've only ever had one symptom which is shortness of breath and this worries me a little as my family members who  also have asthma experience more then one symptom (to be exact they experience coughing, shortness of breath, occasional wheezing, occasional chest pain and chest tightness) \n\nDoes anyone know why I only experience one symptom? Do I really have asthma or is it something else? It's been playing on my mind quite a bit so any and all help would be extremely appreciated! :)",https://www.reddit.com/r/Asthma/comments/uafzde/im_a_little_confused/
uaf4k6,1650748813,accidentally inhaled lint and dust from my inhaler,im dumb. i left my albuteral uncapped and inhaled and felt stiff in my mouth. i spit out lint and am scared i inhaled dirty stuff from my inhaler. will i most likely be fine? i coughed but i think i had anxiety i just need reassurance. used my nebulizer just in case. has anyone made this mistake before? i feel so dumb,https://www.reddit.com/r/Asthma/comments/uaf4k6/accidentally_inhaled_lint_and_dust_from_my_inhaler/
uaa10r,1650733794,This is a dumb question,[removed],https://www.reddit.com/r/Asthma/comments/uaa10r/this_is_a_dumb_question/
ua3161,1650712014,Preventer and rescue inhaler time frame?,"Hi, \n\nI take a preventer puffer morning and night and it’s about 9pm where I live and I usually take my preventer maybe around 11pm but I feel like I need my reliever as feeling a bit tight after having covid and now I have a secondary chest infection (on antibiotics for it). \n\nDoes it matter if I take say two puffs\nNow of reliever puffer, and then go ahead and take my preventer less than 4 hours later? \n\nI assumed I can take my reliever any time what so ever. \n\nCan any asthmatics clarify? \n\nThanks!",https://www.reddit.com/r/Asthma/comments/ua3161/preventer_and_rescue_inhaler_time_frame/
ua1oln,1650706307,Smelling cigarette smoke but no one smokes.,"We’ve been in our house for 6 years. It’s a SFH, no shared ductwork. Everything was fine until this past winter when I started getting heavy smells of smoke (smells like cigarette but could be wood) inside the closed up house.\n\nEventually, other household members would smell it and it would burn eyes &amp; throats. Typically, I’m bothered by it more than anyone else.  Yes, we’ve got working smoke &amp; C02 detectors. \n\nI had our furnace looked at and it’s fine, we use MERV 14 filters in it and change regularly, we’ve got several high capacity hepa filters running the majority of the time, and I’ve started opening up windows (despite pollen allergens) when the outside air smells clean. \n\nI’m at a loss. I’ve always had “super” senses, but why year 6 and not years prior? It’s residential, but is on the edge of the city limits, so there is burning permitted in surrounding areas.\n\nI’ve got asthma and COPD, plus allergies, so the new smoky smell indoors is concerning. \n\nWe live in the western PNW, so this time of year air quality it mostly good. \n\nI grew up exposed to secondhand smoke and bad field burning, which my pulmonologist says is likely why I’ve got chronic lung issues. \n\nAny other low cost suggestions? We’re looking at moving, so don’t want to invest thousands and also curious where (if there are any) the good areas of the country are for us asthmatics?",https://www.reddit.com/r/Asthma/comments/ua1oln/smelling_cigarette_smoke_but_no_one_smokes/
ua18sv,1650704364,Bringing this thread back up…any new input? I’m looking at this very thing now.,null,https://www.reddit.com/r/Asthma/comments/ua18sv/bringing_this_thread_back_upany_new_input_im/
ua019j,1650699139,Has anyone had the same experience when stopping use of inhaled steroids?,Diagnosed with asthma and COPD. Stopped using my Ciclosonide a month ago. Since then my hoarse voice and chest pains have disappeared. My peak flow has also improved a bit. My pulmonologist says I must continue to use the steroids. Has anyone else experienced this?,https://www.reddit.com/r/Asthma/comments/ua019j/has_anyone_had_the_same_experience_when_stopping/
u9wzvj,1650687036,who here has a backup collection of their medication?,I’ve always wanted to have a copy of all my medication (unopened) and available in another location like my cousins place so if let’s say one day i go over and i accidentally forget one or more of my meds I know that I have a backup!\n\nI currently have started a secret stash of my meds - i’ve got about 4/8 so far. \n\nI think it’s something to definitely think about and could save u one day!,https://www.reddit.com/r/Asthma/comments/u9wzvj/who_here_has_a_backup_collection_of_their/
u9wjmd,1650685530,Tips on dealing with asthma at work?,"I work 5 days a week in a plaster manufacturing facility. I work in the front office but there is plaster dust flying around everywhere and it is effecting me quite badly. By the end of the week I'm just about coughing up my lungs. My ventolin and symbicort give me a bit of relief but no where near enough. I've also had predisolone in the past and had a crappy reaction so not keen to start taking those again. \n\nI won't be able to get in to see my GP for another two weeks, so I'm hoping someone can give me some tips on how to deal with this for the time being? Working from home isn't an option at the moment unfortunately. \n\nThanks in advance.",https://www.reddit.com/r/Asthma/comments/u9wjmd/tips_on_dealing_with_asthma_at_work/
u9pwan,1650664731,Prednisone saves the day!,"Been dealing with a cold or miserable allergies for four days. The sickness settled in my lungs this am and for the first time in about 8 years I was getting worried about a possible ER visit — albuterol just wasn’t doing it.\n\nI took 5mg sublingual prednisone and within 45 minutes I feel like a whole new man! Incredibly quick onset and amazing symptom relief 🥲 I’ll probably continue 5mg for the next day or two, then discontinue once the illness has run it’s course. I know how nasty it could be if used chronically. \n\nIf you don’t have prednisone in your toolkit, get on your doctor about procuring some!",https://www.reddit.com/r/Asthma/comments/u9pwan/prednisone_saves_the_day/
u9o3cf,1650659798,Allergies,"Anyone else getting real bad allergies this year really making their asthma go into overdrive? I don’t know what’s different this year but I’ve never such bad allergies nor effects as a result. My nose is just constantly running (pouring really) and I have so much mucus and just can’t breathe. I’ve taken antibiotics because my throat was swollen and I couldn’t talk, I’m taking Motrin for headaches, my nebulizer every 4 hours that I can, my prevention, nasal spray for allergies, Affrin severe, my inhaler constantly. And the allergies won’t stop nor will my breathing improve. I’m not too worried because I know it’ll pass but are there any tips or tricks y’all have?",https://www.reddit.com/r/Asthma/comments/u9o3cf/allergies/
u9mjon,1650655537,"Seeing someone with a cat. I have cat allergies and asthma, how can I still go over to they’re place?","Medicine I’m currently on: Symbicort, singular, prednisone (for 5 days, on day 1). Usually when I’m around cats the most that will happen is my face and skin itches like crazy and gets red. Also sneezing and red eyes. I did notice my asthma bothering me the night after being around cats. What allergy medicines can I take before seeing this person? can I even take allergy medicine with singular?",https://www.reddit.com/r/Asthma/comments/u9mjon/seeing_someone_with_a_cat_i_have_cat_allergies/
u9mb8z,1650654890,Anyone else get nagged about wearing light clothing and in the winter?,"Lol I hate shoes. So I'm always shoeless. Sometimes I walk outside during the winter with no shirt, no shoes, and only gym shorts on lol. It's only a long as I can stand it tho lol. But I constantly have family and others tell me I'm gonna have an attack when literally the opposite is what triggers me lol. I can't stand heat is fine while in the fresh air. But in a car?? No way lol.",https://www.reddit.com/r/Asthma/comments/u9mb8z/anyone_else_get_nagged_about_wearing_light/
u9l2tw,1650651508,allergy shots?,null,https://www.reddit.com/r/Asthma/comments/u9l2tw/allergy_shots/
u9icpc,1650644108,Montelukast,"So, I've been in montelukast for 3 days, I'm not expecting to see much benefit from it yeah but I want to know what others have experienced. \n\nUnfortunately, despite having my jabs covid has left significant scarring on my lungs and this is what we are trying.\n\nI also take the highest dose of relvar ellipta and use sambutamol on a regular basis. \n\nThe second I try to exercise my lungs just give up on me and it's making me getting back into shape borderline impossible.",https://www.reddit.com/r/Asthma/comments/u9icpc/montelukast/
u9grud,1650639877,asthma triggered by covid jabs???,"So I kind of think this cannot be true, and for nearly the last year my doctors have just been telling me when my peak flow dropped that it ""is my new normal"".   And I really don't want anyone to not get the jab because of this, but I want to know if people think my doctors are right or if I may be onto something. \n\nBut looking back, this time last year, my peak flow was around 440 - 450.   Then I had my first covid jab, to which I had a minor reaction.  Very nearly fainted about 30 minutes after wards, followed by an asthma attack, feeling like I had the flue for 3 days, and a half tennis ball sized lump in my arm that didn't go away for 10 days until I started taking some strong prescription antihistamines.   My peak flow dropped to 320 and only recovered slowly up to about 350-360 by the time of my second jab.   \n\nNot long after this I had also injured my achilles and wasn't able to run as much, so when I phoned the doctor my peak flow was just at my ""new normal""  even though the dip was on the night of the covid jab. \nI had some blood tests and nothing came out abnormal except that I have more red blood cells than is considered to be ""normal"" and they are all larger than is considered normal. I was told this is probably just normal for me and is nothing to worry about. \n\n\nMy second jab was similar. This time I was prescribed the antihistamines to start taking 2 days before the jab and to continue for a few days afterwards.  My reaction was pretty much identical to after the first one, except the swelling on my arm went down faster.   My peak flow dipped down to 220 and only recovered up to about 270 to 280. \n\n\nOver these months I also started getting other vague medical issues. I felt constantly tired. My rashes that are so far unexplained became more frequent.  I also gained weight which I put down to not running. I started getting out of breath on my daily walks which I also put down to me getting unfit as the doctors had told me it cannot be the covid jab. \n\n\nA while later I got my booster jab in December.  This time the doctor wouldn't prescribe the antihistamines in advance. He said wait to see how I reacted. This time the reaction was the same but the asthma attack was a little more severe.  The rash was also much worse, it covered most of my left side all the way into my foot. And took a couple of weeks to disappear. This time the doctor was just getting tired of my complaints and didn't seem to want to hear it. He didn't even want to see a photo of the rash (we have only phone call appointments unless the doctor requests one in person).  My peak flow died down to 180 and only recovered up to 240. Though its worth nothing that in the winter my peak flow is often about 30 less than my summer readings. \n\nAfter this I was really struggling. I was blaming myself for gaining weight and was really truing to push myself on my family walks and all my cycle rides.   I now couldn't eat a full meal without feeling completely breathless and feeling the need to make myself throw up some of it to be able to breathe again so I changed my eating habits to be snacking all day long as I couldn't fit in a full meal.  I also found that I was unable to bend down to tie my shoes at the same time as breathing. I struggled to lie down on the bed at the gp surgery when I was getting my ankle examined and when I got my cervical smeer done because they put the bed at a slight angle up which bent my torso. My torso must be straight for me to not feel breathless. \n\n\nOn Tuesday I had a slight sore throat and tested positive for covid. By the evening I had flu like symptoms. I felt the need to cough but I couldn't get enough force for coughing to do anything.   Wednesday evening I was debating calling 999, but I thought I'm not quite that bad. Thursday 830 am I called my gp and when she heard that I could barely get two words out without taking a gulp of breath she insisted I hang up and call 999.  I felt a little better than the night before so I was reluctant but I did. The paramedics arrived, gave me a nebulizer and sent me to the hospital.  At the hospital my peak flow was taken as 190, which was after some treatments. I was sent home that evening (last night) with another 5 days worth of steroids to take.   \n\nThis morning I woke up and for the first time in months, I can breath in without chest pain, and without it feeling like an effort!!  I can also cough! I have never been so happy to be able to actually cough even though it hurts my throat.   I took my peak flow and its already at 290!!! How is that even possible???  And I still have 4 days more steroids to take.   I also just feel overall so much better today.  Its the first day in months that I haven't needed a 3pm nap.   I can bend over to do stuff and not feel so out of breath.   \n\n\nSo I'm thinking that maybe my asthma has been getting worse over the past year and it wasn't just me becoming so utterly fat and unfit. I also hope that now I can start to lose the weight because I cam eat slightly larger portions so won't feel the need to snack and can make healthier choices. I feel like I will also be able to cycle and walk more. \n\n\nBut it just seems impossible, the doctors repeated told me that my peak flow was just my new normal. \n\nHas anyone else had a reaction to the covid jabs that caused their asthma to flair. \n\nOne weird thing of note is that in the hospital, although it was after the nebulizer, the doctor couldn't hear anything wrong with my lungs. I also usually haven't been wheezing. I've just been finding it very difficult to pull air into my lungs. \n\nI don't want to bring this up to the doctor for them to just laugh at me because it is due to my weight after all and I'm just being stupid. \n\n\nI'm female, 28, 5'2 or 158cm was 85kg a year ago and am now 96kg.",https://www.reddit.com/r/Asthma/comments/u9grud/asthma_triggered_by_covid_jabs/
u9eg91,1650633395,Stay Away From Zempreon,[removed],https://www.reddit.com/r/Asthma/comments/u9eg91/stay_away_from_zempreon/
u9cwup,1650628641,Do I need extra meds traveling to high altitude?,"I will be traveling to Denver CO this weekend for a couple weeks. I was told since I have asthma, I will likely feel the altitude change for a couple days. Was wondering if anyone has experienced this when traveling to higher altitude, did albuterol help? I’m also on advair which I take 500/50 2x a day. I don’t want to have to bring my nebulizer, but I could.",https://www.reddit.com/r/Asthma/comments/u9cwup/do_i_need_extra_meds_traveling_to_high_altitude/
u9c9pf,1650626356,Told not to use inhalers...what to do?,"Hi, during my last visit a lung specialist told me I have (likely) been misdiagnosed with asthma and told me to stop using my inhalers (without proposing an alternative diagnosis) until the next visit in 3 months. I'm wondering what to do now in terms of seeing other specialists, exercises, etc. \n\nMy symptoms were:\n\n1. Shortness of breath during cardio (20+years)\n2. unable to talk without coughing (Fall\~spring for 7 years)\n3. Mucus, choky feeling, heavy breathing during the day (from fall 2021)\n\nReasons for misdiagnosis were:\n\n1. Normal Lung capacity (but I can't exhale on the spirometry for +6 seconds, and I usually stay around 600 peak flow with my max 750)\n2. Normal IgE levels (but still have allergies and atopic symptoms)\n3. Ventolin not showing improvements (this is true. Have only worked a few times) \n4. Maintenance inhalers not working (but inhalers+spacers got rid of my cough entirely. Instead started to develop other symptoms with the inhalers)  \n\nI'm pretty sure stopping the inhalers will do nothing against my shortness of breath and my cough will just come back next fall (perhaps will just stop my other symptoms). Should I push for a second opinion on the diagnosis? Or get a referral to specialists for VCD, GERD, allergies, etc. ?",https://www.reddit.com/r/Asthma/comments/u9c9pf/told_not_to_use_inhalerswhat_to_do/
u988rn,1650609844,Can you take flovent hfa and symbicort?,"Hi guys, I was wondering if one can take/ be prescribed both flovent hfa and symbicort. Flovent hfa seems to be helping me somewhat and I don't want to stop using it but I really feel like it's not helping enough. I've read multiple people having success with symbicort so I was thinking of asking my pulmonologist about taking symbicort. Can these inhalers be taken together? Any thoughts and information would be appreciated. Thanks!",https://www.reddit.com/r/Asthma/comments/u988rn/can_you_take_flovent_hfa_and_symbicort/
u985qj,1650609495,Anyone awake to walk me through what to do if I think I might be having an asthma attack?,"-  34F\n- shortness of breath, feels like I can’t get a full breath \n- chest tightness \n- excessive yawning and sighing to help get air \n- some coughing\n- a feeling of fullness at the base of my throat, like mucus that I can’t clear\n- some mild panic, threatening to get bigger \n- oximeter reading normal, heart rate slightly elevated \n\n\nI’ve had some symptom for a couple of days and have a Dr appt tomorrow.  I’m not diagnosed but i don’t know what else this could be. I’ve had this happen only one time before, when I had covid, and j wasn’t sure what it was. I suspect allergies are what triggered this flare-up. But I can’t sleep right now and I’m freaking out.\n\n\nPlease send good thoughts and advice.",https://www.reddit.com/r/Asthma/comments/u985qj/anyone_awake_to_walk_me_through_what_to_do_if_i/
u97num,1650607460,Not sure what to do currently,"I’ve been recovering from what I’d probably just a post-infectious cough. But unfortunately it means I’m coughing a lot more and it seems like it’s just making my asthma worse.\n\n\nI’ve been in my room for most of the night not doing anything and yet again I’ve been coughing and getting short of breath. I tried taking two doses of my meds (salbutamol) and that has done absolutely nothing to help. I really just want the coughing to go away. And I do not want to have to go to emerg again on account of what happened last time\n\nI’m not sure what can be done or if anything can be. If there is anything you recommend I do that can help, please let me know.",https://www.reddit.com/r/Asthma/comments/u97num/not_sure_what_to_do_currently/
u97gug,1650606713,"Potential misdiagnosis? 4 year old has a cough for 5 days, Dr heard a wheeze with stethoscope and diagnosed as asthma. Last time child had a cough was 2 years ago lasting over a month at nighttime. No other risk factors for asthma. All advice appreciated.",null,https://www.reddit.com/r/Asthma/comments/u97gug/potential_misdiagnosis_4_year_old_has_a_cough_for/
u967o8,1650601958,"Just got prescribed 40 mg of prednisone for asthma, should I expect any side effects?",I’m currently on Symbicort and singular and will add on the 40 mg of prednisone daily tomorrow morning for 5 days. I’m worried about any side affects and if a 5 day course of it will even help me a whole lot?,https://www.reddit.com/r/Asthma/comments/u967o8/just_got_prescribed_40_mg_of_prednisone_for/
u95tsc,1650600549,Cold variant asthma more sensitive,"Hi everybody, I’m in my late 20s and have had cold asthma since I was a baby. I have qvar that I take daily (usually 1 puff in the morning) and I took Flovent as a kid. I have Ventolin for a rescue inhaler and for a few years, I’ve only needed to take it when I’m sick. \n\nBut lately I’ve been much more sensitive to the cold and I get congested/my chest tightens a little bit. This happens when I’m outside in the cold or have the AC on a lower temp. Today I’m really congested, extra phlegmy (which made me sick) and coughing because I slept with the AC on as it was hot outside. I don’t have Covid. As soon as I raised the temp of the room, I felt a bit better.",https://www.reddit.com/r/Asthma/comments/u95tsc/cold_variant_asthma_more_sensitive/
u90bp4,1650583020,Can you take salbutamol inhaler along side breo?,Ive been taking breo daily and my cough &amp; asthma is getting worse. I just took 2 puffs of salbutamol and i feel slightly better. \n\nCan i take salbutamol alongside breo or should i stop taking breo?,https://www.reddit.com/r/Asthma/comments/u90bp4/can_you_take_salbutamol_inhaler_along_side_breo/
u8y1ux,1650576428,I think I may have to rehome my dog because of my allergies - help!,null,https://www.reddit.com/r/Asthma/comments/u8y1ux/i_think_i_may_have_to_rehome_my_dog_because_of_my/
u8szep,1650562412,Do spacers actually work?,"Hey everyone, I've been suffering from asthma all my life and inhalers barely help. I'm currently having really bad lung problems, and I was given a spacer. It's weird, whenever I use it it feels like I only get half a breath out of it, I can't breath to my full capacity (which isn't much) and I don't feel the medication doing anything. Compared to when I use the inhaler straight to mouth I can take a ""deep"" breath and feel it go down. It's an AeroChamber to be specific, in the front of it there's a small plate that opens about a centimeter when you breath in, but won't that block some medication? I'm not a Dr. and I've heard good things about them online, but it feels more effective when I don't use it, so I'm curious to hear everyone's opinions on them. Thanks.",https://www.reddit.com/r/Asthma/comments/u8szep/do_spacers_actually_work/
u8s3e5,1650559998,"Went off singulair, allergies are real bad?","So like a lot of you, I went off singulair because it really messed with my mental health. It’s going on 3-4 weeks since I’ve been off it, and after being outside for work all week, my allergies are BAD. bloodshot eyes everyday, woke up with posnasal drip causing a pretty bad sore throat. Took a Covid test last night and it was neg, but this feels like allergies anyway. \n\nAsked the pharmacist what the strongest alternative to Zyrtec would be, because Zyrtec isn’t cutting it. Anyone have suggestions? My asthma has been okay, just minimal wheezing from the posnasal drip. Not enough to need an inhaler. \nJust would like to hear others thoughts on stopping the singulair, how their allergy maintenance is, and what I should do. Haven’t really had bad allergies in the last couple years from wearing masks and being on the singulair.",https://www.reddit.com/r/Asthma/comments/u8s3e5/went_off_singulair_allergies_are_real_bad/
u8poos,1650553508,Can someone explain to me how a PFT with an irritant works?,"I had a PFT last summer when I primarily had asthma in response to cigarette and fireplace smoke.  They did not use an irritant. The PFT didn’t show that I had asthma; I was told this as probably because I wasn’t exposed to the smoke during the test. They have been treating me with an inhaled steroid and inhaler and montelukast since then. \n\nI have another PFT next week, this time with an irritant . I know that if I stop the steroid and monteleukast, I do wheeze either all the time or on any strong inhale. So I think I will be wheezing before they even add the irritant. So will there even be a difference when they add the irritant, if I am wheezing to start? \n\nAlso is it strange that I wheeze on the inhale when I don’t take the asthmanex steroid? \n\nI am pretty nervous as I have A LOT of trouble breathing if I miss a dose of either the steroid or montelukast.",https://www.reddit.com/r/Asthma/comments/u8poos/can_someone_explain_to_me_how_a_pft_with_an/
