id,created_utc,title,selftext,full_link
u32j6p,1649889789,ya b*tch got pain. any advice?,My lungs have been hurting recently. Its like a dull ache that's persistent on top of the usual stabbing cramps i get multiple times a day. Is there anything i can do ab this where i dont have to go to the doctor? Inhaler doesn't really help either,https://www.reddit.com/r/Asthma/comments/u32j6p/ya_btch_got_pain_any_advice/
u31unl,1649887850,Advair after awful reaction to prednisone,"I am new to Reddit, so I hope I’m posting this correctly, but I am curious to see if anyone has been put on advair after a severe reaction to prednisone?\n\nWhen I was 8 I had a severe and almost deadly asthma attack for the first time. I was hospitalized for three days and sent home with prednisone to take for a week after. Well, three days in my parents had me stop taking it because not only was I very emotionally unstable, but I was screaming about wanting to kill someone and how angry I was at everything. So we stopped taking it. It took me almost two months to “come back” \n\nFast forward until now I have been using just an albuterol inhaler to manage my symptoms. However since moving into a mold ridden apartment I’ve been having 3-5 asthma attacks a day and waking up unable to breathe at night. I finally went to the doctor today and she prescribed me a 250/50 advair inhaler and a week of some other steroid medication. \n\nI’m wondering if anyone else has had luck with  advair after prednisone reactions, and if I should be worried.  My dr. Is really nice but she kind of just brushed me off and said we will see how I feel after a month.  I’ve got a job and shit to do so I can’t go through another really bad reaction again.",https://www.reddit.com/r/Asthma/comments/u31unl/advair_after_awful_reaction_to_prednisone/
u2zzeo,1649882899,FLOVENT opinions?,"Hi,  \nI'm about to try out Flovent, been feeling short of breath with normal X-Ray, Spirometry and Oxygen levels. Pulmonologist said it's likely anxiety, but i'm very sensitive to mold, dust and exhaust fumes(cant breath for weeks afterwards). My physician offered to try Flovent, but reviews are quite negative on webmd and askapatient with major side effects.  \nCould anyone share their experiences? \n\nThank you.",https://www.reddit.com/r/Asthma/comments/u2zzeo/flovent_opinions/
u2xu2v,1649876941,What is triggering my asthma?,"Hey guys, i am desperate at this point and i want to finally know, what is wrong with me! First of all, i want to say, that my symptoms differ when i am outside and inside. Inside (especially my room) i have constant attacks, i have 24/7 phlegm in my back throat or airways (not sure) and sometimes, my lungs even hurt. My chest is heavy and i was also told, that while i am sleeping i am wheezing. I want to say, that our apartment is literally a wet dump - there is constant 70-75% humidity and you can even see wet spots on the ceiling (especially in my room). \n\nI was tested for allergies and i am allergic to dust mites, although i have been allergic to it my whole life and my asthma problems started only at age 21. I have tried to vacuum every day, wipe dust 2x per week, but it doesnt seem to help. I am on my 3rd maintance inhaler. Now i started Relvar Ellipta (Breo) - lowest dosage, i am on day 3-4, but it doesnt seem to help at all. Albuterol doesnt work for me at all it seems. \n\nThen i though, maybe its GERD? Sometimes i have burning sensation in my chest, more when i am drinking alcohol and especially, when i am stressed. So i recently bought ozepramole 20mg and i am on day 3, but again, i see no difference. \n\nWhen i am outside, my symptoms pretty much dissapear. I was cycling today and i had some phlegm, but waay lower and i wasnt coughing at all. So i dont really understand what is wrong.\n\nI have also tried to change place - i went to dormitory, but my asthma symptoms stayed. I mean, i cant clean the room - only vacuuming, so idk. But humidity should be way lower.\n\nAlso, i dont know, if it can be connected, but i have problem with candida (oral thrush), but probably had it down there also and i didnt know about it? Maybe it got to my lungs somehow? You see, i am desperate. \n\nDo you guys have any reccomendations what to do? I am so desperate, that i am willing to pay 60€ to get tested for pulmonary chlamydia, candidas and other stuff. Thanks for any advices.",https://www.reddit.com/r/Asthma/comments/u2xu2v/what_is_triggering_my_asthma/
u2xhnk,1649876006,"I get asthma attacks nearly every time I eat. There’s no pattern, no time of year, no certain foods. Any ideas of why or if this is normal?",null,https://www.reddit.com/r/Asthma/comments/u2xhnk/i_get_asthma_attacks_nearly_every_time_i_eat/
u2vx0h,1649871757,Asthma meds increase my heart rate. Are there any out there that don't?,"**^(Notice: Yes I do plan on talking to my doctor. This is not asking for medical advice so much as it is asking for other people's personal accounts of their current medication regime. So I ask kindly that you move on if your only advice is ""Just talk to your doctor"".)** \n\nI'm 34F and take Montelukast (Singulair), and Symbicort. I only take the Symbicort two puffs once per evening per my doctor's instructions. This is to hopefully separate the number of hours between my Symbicort dose, and my ADHD medication dose. (*As it is a stimulant and also increases my resting heart rate*.)\n\n Currently, my RHR is around 78-84 if I am literally sleeping, and around 95-110 the rest of the day. If I forgot to take my Symbicort at night, and take it in the morning, it's about 110-125 for the majority of the day. If I forget to take it all together, I've noticed my RHR is about 85-95 during the day instead. I have also fought with heart palpitations for the past couple years as well. I have had an EKG done, and all was normal aside from the mild tachycardia.\n\nThings I've tried:\n\n\-I was taking Advair before, one puff once at night. Doc swapped me to Symbicort. No difference in palpitation episodes, or high RHR.\n\n\- I cut caffeine back to one cup of coffee in the morning and maybe a soda in the afternoon. Reduced heart palps, but not overall HR. Ironically, I have drank coffee and then watched it tank down to the 80's. ADHD body chemistry is fun, lol. \n\n\-I do try to walk briskly during my work breaks which amounts to about 30 minutes a day. I know I can probably start running or something, but I also know my medications are jacking up my HR artificially. Interestingly, when I work out and exercise with high intensity, my HR does not get above 175(max aerobic HR for my age).  It usually floats between 130-169 depending on intensity. Which I believe is in line for my age, and fitness level. It drops back to my normal shortly after finishing a work out. \n\n\- I also have been doing allergy shots for about 3 years. I am now at maintenance. It has helped exercise induced asthma reduce, but not my overall attacks. I am unsure if this is due to dependence on corticosteroids, or if my asthma has really not improved at all. If I miss a dose, you can guarantee I'm hitting my rescue inhaler.\n\nIs there anything out there I might try to see if it helps lower my HR? A different class of maintenance inhaler like Long acting beta antagonists only? Or, corticosteroid only? (as opposed to a combo drug like what I'm on) Or, should I just start running (not a fan) and see if I can lower it that way?  Eliminate the Montelukast? Try a beta blocker along side it? (If I do beta blockers I can no longer continue my allergy shots). Eliminating the ADHD stimulant would honestly be a dead last resort for me. I'd rather be functional and wheezy, then nonfunctional and non wheezy. \n\n**TL/DR**: Yes I plan on talking to my doctor. If anyone had their asthma meds increasing your HR, how did you handle it? And if you switched or eliminated meds, what did you use/do?",https://www.reddit.com/r/Asthma/comments/u2vx0h/asthma_meds_increase_my_heart_rate_are_there_any/
u2sn3x,1649862986,Anyone else have this side effect?,"I tried googling this and couldn’t find an answer, so I made a Reddit account just to see if anyone else could relate. I am F(24) and I was diagnosed with asthma in high school. They told me it was exercise-induced, but it also flares up with my allergies.\n\nAnyway, I noticed whenever it gets triggered I get more and more giggly until everything is embarrassingly hilarious to me. I have a working theory that this is because less oxygen is going to my brain when I’m not breathing as well, but I couldn’t find anything online to confirm. Am I the only one who’s experienced this?",https://www.reddit.com/r/Asthma/comments/u2sn3x/anyone_else_have_this_side_effect/
u2s5in,1649861707,"Tobacco smoking as an asthmatic. What can I expect, especially as I age?","So I am an Asthmatic (moderate, have an emergency rescuer and a preventer inhaler that I take twice a day). I have recently taken to smoking cigarettes (in the region of 1 pack a week-ish but more when drinking, and I usually roll my own) and cigars as well (1 or 2 a week in addition to the cigarettes). I am 20 years old, have been smoking for a year now and I have a BMI of around 18.5 (175cm/ 5'9 and I weigh 57 kg or just under 130 lbs).\n\nWhat can I expect from this? I am not blind to the dangers of smoking and I am aware of the risk but I am feeling fit and I was just wondering what will happen as I get older. I am in no rush to quit or anything and I like having it as part of my life even if it isn't exactly good for you.",https://www.reddit.com/r/Asthma/comments/u2s5in/tobacco_smoking_as_an_asthmatic_what_can_i_expect/
u2rmxz,1649860236,How to start working out again?,"Hey everyone, I’m a guy in his mid twenties trying to get in shape again. I have some joint issues that make it tough, but the real challenge is asthma and vocal chord dysfunction really tripping me up on any cardio at all. Does anyone have any tips/training plans/videos/prep regimens to help with this sort of thing? I’m tired of being so out of shape",https://www.reddit.com/r/Asthma/comments/u2rmxz/how_to_start_working_out_again/
u2iyun,1649827356,is it safe for child to be in the house during construction,"We’re turning my mother in laws old room into a new bedroom for my daughter and to do that we’re going to have to remove the carpet, put down hardwood and paint. Should I have my daughter out of the house for this? She and I disagree. She’s been having a really rough allergy season and I’m concerned about stirring up dust when she’s already hypersensitive. She thinks she’ll be ok if she just stays away from the room while the carpet is being pulled up. We were just in urgent care so idk if it’s smart to risk it.",https://www.reddit.com/r/Asthma/comments/u2iyun/is_it_safe_for_child_to_be_in_the_house_during/
u2fm1y,1649816065,Meds aren’t helping.,"I’ve had some chest pain followed by breathlessness for a few days, so I decided to go get it checked out. The doctor did a few tests including an X-ray on my lungs and then he diagnosed me with asthma. He decided to give me pills to have once every day, but I don’t see a lot of improvement. Could this be a sign of COPD? Btw I’m 22 years old. Thanks for anyone that gives me their opinion ❤️",https://www.reddit.com/r/Asthma/comments/u2fm1y/meds_arent_helping/
u2fkd5,1649815917,Trezpire,Been on Xolair for over a year. Still needing to be on prednisone more month out of the year than not. Currently on Spiriva and the highest does of Advair available. Just switched from Xolair to Trezpire. Anyone been on Trezpire yet? Had any good results?,https://www.reddit.com/r/Asthma/comments/u2fkd5/trezpire/
u2fjh7,1649815842,Has anyone had less issues with respiratory viruses since getting a pneumococcal vaccine?,"I have mild asthma. It’s mostly exercise-induced, which not doing much intense cardio these days so it doesn’t effect me. I also feel my lungs get inflamed when pollen counts are super high, so I avoid lots of outdoor activities during those times. I’m not using an inhaler currently.\n\nThe main issue I have, is that whenever I catch a cold or other respiratory virus, I cough (dry cough) for 2-3 weeks past other people in my household. I’ve never had pneumonia, so never even considered a pneumococcal vaccine. Someone in another group told me getting this vaccine for her son stopped him from getting bad coughs from colds and whatnot though. Apparently he used to get colds that would go to his lungs a lot, but now he never does. I’m just wondering if maybe this vaccine could help keep me from coughing for weeks after a cold. Also considering it because I haven’t had covid yet, and I read the pcv13 vaccine specifically can help reduce c19 severity (link included). \n\nhttps://about.kaiserpermanente.org/our-story/health-research/news/pneumonia-vaccine-may-affect-course-of-covid-19",https://www.reddit.com/r/Asthma/comments/u2fjh7/has_anyone_had_less_issues_with_respiratory/
u2dyad,1649811005,Idk what’s wrong," Recovered from Covid and h pylori and remisson of asthma I was getting better but I started throwing up becuee of stress and it made it hard to breathe for an hour nothing bad, a week later my fist dog passed away and I couldn’t take it so I bought a pen and started smoking it for a day and half ever since then I felt like I was suffocating went to the er and was given predisone and it helped a little bit. Ever since then I feel like I have to suck in the air and then push the breath out, it feels like my throat is alwys extreme tight I can’t even drink anything or eat becuee I can feel it slowly going down my throat, my neck feels heavy, and it’s so hard to talk especially if I’m walking it feels like my throat tightens so much and has spasms, my I don’t really get any chest pain or pressure only my left side right next to my shoulder but that’s my costcondritis. My blood work was fine mt desperation was alway 12-14 and my spo2 has alwys been 96-98, but lately been dropping to 93 for a min or 2, I started getting headaches to but I think that’s becuee of the infection in my mouth Flovent gave me a bad oral thrust lesions in my mouth, I’m literally stressing my self to death I’m so scared to take my pft test in 7 days I’m 21 I have so much more I want to doo I’m literally breaking down every hour I have no one to talk to",https://www.reddit.com/r/Asthma/comments/u2dyad/idk_whats_wrong/
u2aabi,1649799846,Why do my airways close when I smell food?,"So I’ve had this frequently happen for years. I’d like to know if this is common and linked to asthma, so if anyone can help I’d greatly appreciate it. :) Starting off with the first time I took notice of this symptom, I was in high school. I remember on a school day during passing period, I was making my way towards the double doors that lead to the school’s interior hallways, and as soon as I neared the doors a body of students exited the doors I was hit with the gush of the wind that exited out of the hallways, I felt my air ways tighten and was instantly out of breath for some seconds as I made it past the students as the wind traveled away from me. I didn’t think much of it back then and later realized I had developed a defense towards this. Some days after I headed towards the same double doors and caught myself holding my breath in for 4 seconds before I opened it, making it through the body of students I let out a long breath of air that I didn’t know I was holding in. I was hit with confusion, why was I doing that? It’s not like there was a scent of disgust, I then started being more conscious of my behavior and realized I’ve been doing that for a while now and that my body and mind would automatically do this to prevent my lungs from tightening. As this defense seemed to work I continued to do that and it became a regular habit I soon had forgotten about. Until recently that is. along with other instances, yesterday, I had been analyzing my triggers and they seem to range from a wide variety. And this is where it really started to worry me because not only Perfumes but even food! Even my favorite foods that I consumed so much tighten my lungs! I’ve had hot Cheetos, home made foods, meat, yogurt, basically anything. As soon as I take a Whiff of the freshly opened package I can’t breath for a second. But seconds after the sensation is gone and I can consume it normally. And it’s very irregular, so even if i had a bad reaction the first time the second or third I’d be completely fine. So it’s not an allergic reaction. I appreciate any input of what it might be! Thanks again.",https://www.reddit.com/r/Asthma/comments/u2aabi/why_do_my_airways_close_when_i_smell_food/
u29ov0,1649798170,I think I might have asthma.,"I keep wheezing and losing my breath and coughing bad. It used to cough up lots of pleghm but now it's just dry cough or little pleghm, maybe it's allergies mixed with asthma? idk, but do I have asthma?",https://www.reddit.com/r/Asthma/comments/u29ov0/i_think_i_might_have_asthma/
u28l67,1649795244,prednisolone,Hello there I visited my doctor yesterday as I have been wheezing terribly of late he gave me prednisolone I take 6 a day all at once anyway onto my question for anyone that's taken these before so they make you very thirsty? I feel like I need to drink water or pop all the time hoping this is normal.,https://www.reddit.com/r/Asthma/comments/u28l67/prednisolone/
u27nc5,1649792781,"I had a chest infection last week, I have asthma, and since it settles down I’ve had a bad pain on the left side of my throat when swallowing and in my left ear, google said it’s cancer and I’m panicking, I have no other symptoms.",null,https://www.reddit.com/r/Asthma/comments/u27nc5/i_had_a_chest_infection_last_week_i_have_asthma/
u26enm,1649789455,EOE and asthma,"I was diagnosed with asthma this year, but I've been having symptoms and attacks since 2012 at the latest (US healthcare is too expensive so I wasn't able to get diagnosed until I moved out of the country). I've also had dysphagia since 2017 and I've been living off Ensure. I had an endoscopy but they did find anything except H Pylori, which they said was unrelated to having dysphagia. I recently have been researching EOE and I think I might likely have that since I have asthma and I've had severe allergies most of my life. I was wondering if anyone else has experience with EOE? I'll have to get another endoscopy soon and ask them to check for that.",https://www.reddit.com/r/Asthma/comments/u26enm/eoe_and_asthma/
u2636o,1649788613,using rescue inhaler every day,"I was diagnosed with asthma in January, but I've had symptoms of asthma since 2012 at the latest. I was finally able to see a doctor this year, so I did it. They diagnosed me with moderately severe asthma. I use a preventative inhaler twice a day, plus my rescue inhaler when I feel symptoms starting.\n\nI walk my dog every day and I end up using my rescue inhaler probably 5 days every week because of walking my dog. I have silent asthma so I don't usually feel the wheezing; I just have shortness of breath and my chest gets very tight. If I don't quickly use my inhaler, it often turns into a serious asthma attack that leaves me gasping for breath and unable to talk. I didn't get my rescue inhaler until about two weeks ago, so I've only had it for that long. The doctors didn't give me one until I ended up in the emergency room because of an attack.\n\nIs it normal to need my rescue inhaler this often? I've read that I shouldn't need my inhaler more than twice a week, but I definitely need mine at least 4-5 times a week. I have asthma attacks when it's too hot outside, when I walk my dog, when there's pollen in the air, etc. Basically anything you can think of that might cause an attack, I have an attack.\n\nI live in a country where I don't speak the native language so my boyfriend has been doing all the translating at the hospitals for me. He doesn't have asthma so he doesn't understand everything about it. Is there anything I should mention to him that he should ask my doctors about? Or anything I should be doing to avoid using my rescue inhaler so often?",https://www.reddit.com/r/Asthma/comments/u2636o/using_rescue_inhaler_every_day/
u23496,1649780927,https://youtube.com/c/BreatheBetterwithElizabeth,Hi! I’m sharing the link to my YouTube Page which now provides FREE pulmonary rehab as well as breathing tips. I hope it helps!,https://www.reddit.com/r/Asthma/comments/u23496/httpsyoutubecomcbreathebetterwithelizabeth/
u2266c,1649778441,Starting Dupixent (Nervous),"Hello all, \n\nI am just posting today to hear everyone’s pros/cons about starting Dupixent. I am a 26 y/o male with moderate to severe asthma. I usually end up in the hospital once a year due to a severe asthma attack. My esiniophil count in my blood is around 250 which is above normal and is contributing to my asthma symptoms. I since I am young I’m worried about starting a biologic and potentially being stuck on it forever (which aren’t my plans). What are the things I should look out for as well when starting this?",https://www.reddit.com/r/Asthma/comments/u2266c/starting_dupixent_nervous/
u21v8c,1649777628,Getting to know you better,[removed],https://www.reddit.com/r/Asthma/comments/u21v8c/getting_to_know_you_better/
u21r6r,1649777330,Getting to know you better,[removed],https://www.reddit.com/r/Asthma/comments/u21r6r/getting_to_know_you_better/
u1y4mz,1649767160,Blue and brown pumps. Do you have to wait before using or can you use consecutively in the morning/evening?,null,https://www.reddit.com/r/Asthma/comments/u1y4mz/blue_and_brown_pumps_do_you_have_to_wait_before/
u1xcmx,1649764705,This shit really sucks…,hello i am 22 going on 23 in april 30th and i have always dealt with asthma my entire life. i was even hospitalized for 3 months when i was 4 years old. as time went by i honestly couldn’t tell if it got worse or better. there were many times where i felt like i could do normal things and i did! im a skateboarder and i’ve been skating since i was 13 i’ve always had an inhaler with me since i can remember but it wasn’t really bad until 2017 when i graduated highschool i started going out way more than i did in the past as in parties and social gatherings in general cause i used to be a big homebody gamer kid. then i started smoking cigarettes knowing my asthma was bad cause i didn’t care if i died or whatever i was just tired of dealing with this shitty ass condition then came the drugs. now i focus on videography and photography and i stopped buying cigarettes in august 2021. i sometimes fuck around with drugs but i only smoke marijuana most of the time. idk i just feel like part of my depression strings from me having asthma and it really just brings the sad part out of me.. im just feeling lost and useless cause of this shit sorry if i made this really deep just found this thread and thought to share my side with the others who suffer from asthma too.,https://www.reddit.com/r/Asthma/comments/u1xcmx/this_shit_really_sucks/
u1wg62,1649761514,F U asthma RANT,I just want to exercise and not die every time. Frustrated because I have another 15 day wait until my next doctors appointment(they’re so hard to get living rural). Went a month without any issues (I am new to this) and now it’s reared it’s ugly head again but worse than the last time. I get so wheezy and struggle to speak. I sound worse than the 80 + year olds that I care for. When it seems to get better it comes right around and punches me in the chest again. I feel like I’m in a no win situation. :/,https://www.reddit.com/r/Asthma/comments/u1wg62/f_u_asthma_rant/
u1vhz0,1649757940,Does anyone have a heart condition?,"Odd question I know but I kind of fell down a rabbit hole on google last night. Basically I saw articles saying that people with asthma are 1.5 times more likely to develop a heart rhythm disorder. I also saw things saying we have an increased risk for heart attacks and strokes. \n\nThis was mainly for those with persistent and active asthma. I’m only just curious as my heart has been acting up lately, which I didn’t even intend to look this up in the first place lol.",https://www.reddit.com/r/Asthma/comments/u1vhz0/does_anyone_have_a_heart_condition/
u1ut8n,1649755056,Is this asthma?,"So i've been having trouble breathing for a long time (mild) but from like 2 weeks ago i have trouble breathing all day even when i'm just sitting in bed,every like 3 days i have really bad pain in my chest area for like a minute when i breath,i also cough in the mornings and at night even tough i don't have any other sickness.I haven't went to any doctors yet nor have i taken any medicine",https://www.reddit.com/r/Asthma/comments/u1ut8n/is_this_asthma/
u1oxiq,1649732069,Question,"This might seem dumb, but be kind because I’m genuinely wondering. For those who have SEVERE asthma and nothing seems to work, would a lung transplant cure their asthma? You hear COPD patients getting them if it’s bad enough, so would that stop asthma for someone who suffers badly? I’m new to asthma I have mild, but I was thinking of those of you who have it bad! My heart goes out to you. What do they do when nothing helps or works?\n\nIt’s late night and my mind was wandering off. Might sound dumb, but I genuinely would love to know why or why not.",https://www.reddit.com/r/Asthma/comments/u1oxiq/question/
